{
  "schema_version": 1,
  "milestone": "M13",
  "status": "qualified",
  "start_sha": "66138e6539e4220ae7b6d3ffee24581e0d674267",
  "qualified_implementation_sha": "7ddca85c1bf3ee74fea396a27a3a75d91cb78a21",
  "child_commit": "e432296345f1ccc783a42c02baa7ffe4bd2a6eb8",
  "freecom_commit": "6cd372bdd8d54cecbde1635f1296795eb78712af",
  "country_commit": "23f189cca3420606eae8723884fa92ccd65eb307",
  "vaeg_commit": "7dd453cbd36014ba453a26765b00cd0cc9a99655",
  "toolchain_lock_sha256": "39c5b3052d71463235a26e8704ab54c1fedb51ee75bb4efb55e6229391a95162",
  "m12_manifest_sha256": "46427247cf2a347361c3a69ba81fd9981141485693d150213efed38ec4b72c77",
  "m12_qualification_sha256": "7096190b41614dc207de32759e19ce93dbceb9efdc610b79142648f553af7ff6",
  "m12_component_lock_sha256": "62392e64c4ad36282dd530e3012773c5d17b9ee86947746bd34c92948e525570",
  "artifact_manifest": {"path": "qa/golden/m13/manifest.json", "sha256": "84c80cde6e11dcba7101528d0aed8f3d7f860ccf3c61f705678ff1d4d2889517"},
  "qualification": {"path": "qa/golden/m13/qualification.json", "sha256": "edf0cc28c69b707cf27428a249379425769a30f4b80eb7c64b9f82e9d2726833"},
  "component_lock": {"path": "manifests/m13-components.lock.json", "sha256": "b4ee3dc594224e0e6bd97cb83669549b25d844b1ba7bcd2b435d6e22a02203e9"},
  "build_variant": "Open Watcom 1.9 PC-88VA common FreeDOS core with ASCII FreeCOM",
  "volume": {"sector_bytes": 1024, "sectors_track": 8, "heads": 2, "total_sectors": 1280, "filesystem": "FAT12", "read_only": true},
  "common_core": ["FreeDOSmain", "INT21", "blockio", "fatdir", "fatfs", "fattab", "fcbfns", "memmgr", "task", "entry", "procsupt", "execrh", "chario"],
  "shell": {"source": "components/freecom", "variant": "generic ASCII", "loaded_from_volume": true},
  "child_ci": {"repository": "nakatamaho/fdkernel", "run_id": 35132779485, "attempt": 1, "head_sha": "e432296345f1ccc783a42c02baa7ffe4bd2a6eb8", "workflow_path": ".github/workflows/ci-build.yml", "required_jobs": ["build", "test"]},
  "parent_ci": {"repository": "nakatamaho/freedos-pc88va", "run_id": 35138781354, "attempt": 1, "head_sha": "7ddca85c1bf3ee74fea396a27a3a75d91cb78a21", "workflow_path": ".github/workflows/m13-readonly-freecom.yml", "required_jobs": ["public-readonly-freecom", "historical-regression"]},
  "publication_policy": {"tracked_report": "documentation", "metadata": "config/m13/machine-contract.json"}
}
